newsId,url,title,content,summary,keyword,publishAt,categoryName,categoryId
5730323,https://news.cnyes.com/news/id/5730323,分析：若川普11月勝選 這3家科技巨頭可能會暴跌,"&lt;p&gt;美國資深分析師 Sean Williams 指出，若前總統川普 11 月大選取得勝利，預計 3 家科技巨頭可能會暴跌。&lt;/p&gt;

&lt;h6&gt;領先的人工智慧巨頭輝達 (NVDA-US) 可能面臨一些困難阻力&lt;/h6&gt;

&lt;p&gt;Williams 於報告中提到，儘管降低企業稅率的前景可能至少暫時提高輝達的毛利率並使其能夠維持更多收入，但川普經濟計畫的另一個關鍵方面有可能限制輝達的上漲空間。&lt;/p&gt;

&lt;p&gt;具體來說，川普計畫對世界第二大經濟體中國採取強硬立場。他提議對從中國進口到美國的商品徵收 60% 的關稅。儘管輝達不從中國進口產品，但全球第二大經濟體一直是輝達銷售的主要來源。川普引發貿易戰的可能性可能會完全影響輝達的中國營收。&lt;/p&gt;

&lt;p&gt;除此之外，美國政府的監管機構在過去兩年曾兩度限制輝達向中國出口高性能人工智慧 GPU 的能力。Williams 認為，川普或他的政府不太可能放鬆或取消這些限制，這些限制限制輝達在關鍵市場的收入潛力。&lt;/p&gt;

&lt;h6&gt;第二個可能會暴跌的是美國電動車龍頭特斯拉 (TSLA-US)&lt;/h6&gt;

&lt;p&gt;特斯拉利用其領先優勢，從頭開始，計劃到 2030 年為止，在全球推出從輕型商用到旗艦級的 30 款電動汽車，年產量超過 200 萬輛。它成為第一家產生經常性利潤的電動車公司，並試圖透過擴展到能源儲存領域來實現業務多元化。&lt;/p&gt;

&lt;p&gt;川普暗示，如果 11 月連任，他將給予特斯拉執行長馬斯克 (Elon Musk) 在其政府中的職位，但他也對電動車稅收抵免和稅收優惠持批評態度。雖然川普沒有具體表示他將取消新購買的 7,500 美元電動車稅收抵免，但他的政策聲明表明這是確實有可能的。&lt;/p&gt;

&lt;p&gt;截至 6 月底的季度，特斯拉約 66% 的稅前收入來自這兩個來源，其中 18.9 億美元的稅前利潤中有 8.9 億美元來自汽車監管信貸。&lt;/p&gt;

&lt;p&gt;目前還不清楚川普的關稅政策將如何影響美國公司電動車的海內外銷售。自 2023 年初以來，特斯拉一直在積極降低其電動車 (Model 3、S、X 和 Y) 的銷售價格，以應對日益激烈的競爭和不斷上升的庫存水準。不幸的是，這些降價並沒有阻止庫存水準逐年上升，也削弱了公司的營業利潤率。&lt;/p&gt;

&lt;h6&gt;蘋果也可能岌岌可危&lt;/h6&gt;

&lt;p&gt;Williams 指出，儘管蘋果的股價在 2024 年因人工智慧雄心和最終將人工智慧工具納入其最暢銷的 iPhone 中而飆升，但多年來真正的亮點還是該公司的服務部門。&lt;/p&gt;

&lt;p&gt;與輝達類似，蘋果也可能受益於企業稅率的進一步降低。自 2013 年初以來，蘋果已回購了價值 7,006 億美元的普通股，其流通股數量在此過程中減少了 42.2%。較低的企業稅率可能會鼓勵更多的股票回購。&lt;/p&gt;

&lt;p&gt;另一方面，蘋果公司從中國進口部分產品，其 iPhone 銷量的很大一部分依賴中國，而且其絕大多數 iPhone(以及 Mac 和 iPad) 都是在中國組裝的。在關稅和與中國的貿易戰引發的潛在反美情緒之間，蘋果可能會看到其本已停滯的成長引擎完全停止。&lt;/p&gt;

&lt;p&gt;儘管過去 11 年庫藏股在提升蘋果股價方面發揮了關鍵作用，但蘋果成長引擎的問題並不能透過市場領先的股票回購計畫來解決。即使降低企業稅率也不足以抵銷蘋果所有實體產品線一直面臨的持續銷售疲軟的影響。Williams 預測，如果川普在 11 月獲勝，蘋果將陷入困境。&lt;/p&gt;
",美國資深分析師 Sean Williams 指出，若前總統川普 11 月大選取得勝利，預計 3 家科技巨頭可能會暴跌。,"[""蘋果"", ""輝達"", ""川普"", ""美國總統大選"", ""科技"", ""特斯拉""]",2024-10-03 11:00:05,美股雷達,831
5730184,https://news.cnyes.com/news/id/5730184,美東碼頭工人大罷工 業界人士：罷工維持兩周 負面影響持續到明年,"&lt;p&gt;美東碼頭工人發動大罷工，經濟學家正試圖量化從波士頓到休士頓每個主要海上貿易門戶關閉造成的損失：每天損失從 10 億美元到 50 億美元不等。&lt;/p&gt;

&lt;p&gt;美國東海岸和墨西哥灣沿岸碼頭工人周二（1 日）開始了近 50 年來首次大規模罷工，在新勞動合約談判破裂後，美國全國約一半遠洋運輸被迫中斷。&lt;/p&gt;

&lt;p&gt;據《第一財經》周三報導，美國航運業人士都不認為罷工會很快落幕。&lt;/p&gt;

&lt;p&gt;在美國加州長年從事美線運輸的羅杰表示，俗稱的東岸實際上代表東岸和墨西哥灣，即從最北的波士頓到最南的休士頓碼頭都會被波及，東岸墨灣碼頭每周大概處理 50 萬個 20 英尺貨櫃（TEU），罷工的影響的確很大。&lt;/p&gt;

&lt;p&gt;羅杰說，留給船東的預案不多，是否改掛港口，取決於對罷工時間長短的判斷。如果罷工幾天就結束了，沒必要改港。假如船東最後選擇在錨地等泊，一旦碼頭重開，預料各地港務局會按照 2021～2022 年大塞港事件處理方式，安排卸船次序。&lt;/p&gt;

&lt;p&gt;他預判：「業界普遍共識是，罷工一周帶來的影響需要 4～6 周恢復，如果不幸維持兩周或以上，負面影響將持續到明年。」&lt;/p&gt;

&lt;p&gt;「過去的經驗告訴我們，很多影響會在幾個月後才出現，比如東岸的空櫃不能及時回到亞洲。」羅杰解釋道，「2025 年的春節是 1 月底，12 月開始節前趕貨，本來 10 月從美東的船帶空櫃回去，剛好給 12 月出貨用，罷工造成幾周的空櫃空窗期，是否會引發缺箱？大規模船舶改掛美西的話，是否會大幅推漲美西運費？這些都是未知數」。&lt;/p&gt;
",美東碼頭工人發動大罷工，經濟學家正試圖量化從波士頓到休士頓每個主要海上貿易門戶關閉造成的損失：每天損失從 10 億美元到 50 億美元不等。,"[""美東"", ""罷工"", ""航運"", ""碼頭工人""]",2024-10-03 11:00:02,國際政經,833
5730352,https://news.cnyes.com/news/id/5730352,AI頂尖獨角獸！OpenAI完成融資66億美元 估值1570億美元 罕見投資限制,"&lt;p&gt;OpenAI 周三 (2 日) 表示，已完成最新一輪融資，募得 66 億美元資金，公司估值達 1570 億美元，穩居人工智慧 (AI) 領域頂尖獨角獸地位。&lt;/p&gt;

&lt;p&gt;本輪融資由美國新興風投機構 Thrive Capital 領投，微軟 (MSFT-US) 持續參與，值得注意的是，輝達 (NVDA-US) 和軟銀 (9984-JP) 首次對 OpenAI 進行投資。其他參與的投資方還包括 Khosla Ventures(OpenAI 史上首家創投)、Altimeter Capital、富達、Tiger Global 以及阿聯酋的 MGX 投資公司等，但他們並未披露投資規模。此前有傳聞稱蘋果 (AAPL-US) 並未參與此次融資。&lt;/p&gt;

&lt;p&gt;科技媒體 The Information 爆料，OpenAI 要求投資人的最低投資規模為 2.5 億美元。在融資過程中，OpenAI 被紅杉資本、蘋果公司拒絕了。&lt;/p&gt;

&lt;p&gt;這筆資金以可轉換債券的形式提供，若 OpenAI 能順利轉型為一家不受非營利董事會約束的營利性企業並取消投資者回報上限，則這些投資將轉化為股權。否則，OpenAI 需向投資者償還這筆債務。&lt;/p&gt;

&lt;p&gt;根據報導，OpenAI 營收預測顯示，今年營收將達到 37 億美元，明年將增長近兩倍至 116 億美元，且 2029 年上看 1000 億美元的驚人規模。&lt;/p&gt;

&lt;h6&gt;別吃著碗裡、看著鍋裡&lt;/h6&gt;

&lt;p&gt;本輪融資中，Thrive Capital 的投資額約為 13 億美元，其中約 7.5 億美元為直接投資，另外 4.5 億美元則來自其他渠道。根據彭博社的消息，微軟投資 7.5 億美元，而軟銀的投資規模約為 5 億美元。&lt;/p&gt;

&lt;p&gt;另外，英國《金融時報》報導，&lt;span style=&quot;color:#FF0000&quot;&gt;OpenAI 對投資者提出特殊要求，要求他們避免對競爭對手的新創公司進行投資，例如 Anthropic 和馬斯克的 xAI。&lt;/span&gt;這一要求在業內引發了廣泛關注，因為它可能會影響投資者的決策和市場競爭格局。&lt;/p&gt;

&lt;p&gt;今年 5 月，馬斯克的 AI 大模型獨角獸 xAI 宣布獲得 60 億美元融資，出售了該公司 25% 的股份。而如今 OpenAI 融資 66 億美元，僅賣出了約 4% 的股份。&lt;/p&gt;

&lt;p&gt;輝達今年 6 月也曾參與法國明星 AI 獨角獸 Mistral 進行的 6 億歐元融資活動。&lt;/p&gt;

&lt;h6&gt;領投特權惹惱投資者&lt;/h6&gt;

&lt;p&gt;領投的 Thrive Capital 在本輪融資中享有特權：&lt;span style=&quot;color:#FF0000&quot;&gt;若 OpenAI 實現了預期營收目標，明年 Thrive Capital 還可以按照 1500 億美元的估值向 OpenAI 再投資 10 億美元&lt;/span&gt;。鑑於 OpenAI 近年來飛漲的估值，這項條款或將為 Thrive Capital 帶來極大的經濟利益。&lt;/p&gt;

&lt;p&gt;據兩位知情人士透露，OpenAI 的其他投資者都沒有獲得相同的條款，其中一些投資者對這種特權感到不滿。&lt;/p&gt;

&lt;h6&gt;轉型為營利性企業的挑戰&lt;/h6&gt;

&lt;p&gt;根據 OpenAI 的計畫，&lt;span style=&quot;color:#FF0000&quot;&gt;該公司需在兩年內完全重組為營利性企業，若未能如期完成，將面臨將此次融資轉為債務的風險&lt;/span&gt;。這一轉型過程涉及複雜的法律程序，OpenAI 需依照美國法律重新分配資產，這在業界尚屬罕見。&lt;/p&gt;

&lt;p&gt;OpenAI 在其官方部落格中表示，這筆資金將主要用於強化其在前沿 AI 研究的領導地位，提升計算能力，並開發幫助人類解決問題的 AI 工具，其最終目標是使高階智慧（advanced intelligence）成為廣泛可用的資源。OpenAI 強調，未來將與包括美國及其盟國政府在內的主要合作夥伴共同合作，釋放 AI 技術的全部潛力。&lt;/p&gt;

&lt;h6&gt;得持股才栓得住 Altman&lt;/h6&gt;

&lt;p&gt;《華爾街日報》報導，執行長 Sam Altman 在投資敲定前，已經與董事會討論首次收購該公司的股權。&lt;/p&gt;

&lt;p&gt;一位與會者聲稱，Altman 和 OpenAI 財務長 Sarah Friar 都提到，投資者對 Altman 在 OpenAI 沒有持股的問題存在顧慮，他們認為 Altman 持股可以確保其利益與公司深度綁定。&lt;/p&gt;

&lt;h6&gt;機遇與挑戰並存&lt;/h6&gt;

&lt;p&gt;本輪融資標誌著 OpenAI 在全球 AI 領域的進一步擴張，然而，公司核心高管大換血、安全問題及缺乏穩定的收入來源等挑戰也不容忽視。這些因素將成為 OpenAI 在新的商業模式下必須面對的重要課題。&lt;/p&gt;
",OpenAI 周三 (2 日) 聲明表示已完成最新一輪融資，募得 66 億美元資金，公司估值達 1570 億美元，穩居人工智慧 (AI) 領域的頂尖獨角獸地位。,"[""openai"", ""軟銀"", ""微軟"", ""籌資"", ""AI"", ""美股""]",2024-10-03 10:33:14,美股雷達,831
5730347,https://news.cnyes.com/news/id/5730347,忙到冒煙！十一長假廣州、上海看房人氣旺 銷售人員加班到凌晨,"&lt;p&gt;自「924 新政」推出與多地城市鬆綁甚至解除住房限制措施，中國房市交投氣氛濃厚，不少建案售樓處座無虛席，甚至要看樣板房都需要排隊，國慶長假更未放假，黃金周首日更出現銷售員加班到淩晨一點，人多到超出預期的景象。&lt;/p&gt;

&lt;p&gt;廣州某建案銷售人員告訴《21 世紀經濟報道》，廣州全面取消限購加上目前正值十一長假，客戶來訪量較往常工作日增加三倍，成交量達到雙位數；十一當日預約客戶超過 400 組，單日來訪超過 200 組，成交 39 套，無論是熱度還是成交量均明顯上漲，客戶成交周期更明顯縮短。&lt;/p&gt;

&lt;p&gt;位於天河的能建天河麓譽府銷售人員張洋也向《信息時報》表示，十一當日早上 9 點行銷中心才開門，但開門前就有十幾個客戶在門口等，光是當天上午有近五十組客人來看房，他昨晚和同事加班到凌晨一點，早上準時來銷售中心。&lt;/p&gt;

&lt;p&gt;有建案還從周邊專案急調人員來幫忙接待人員，銷售人員廖小姐說：「自己從早上八點半忙到中午，都來不及吃飯。」&lt;/p&gt;

&lt;p&gt;另據上海《新民晚報》報導，十一黃金周第一天也是上海房市新政策實施首日，松江區、寶山區、浦東新區等多個售樓處都迎來許多「新面孔」，大戶型房源更是搶手，部分售樓處黃金周七天的接待名額都已全部約滿。&lt;/p&gt;

&lt;p&gt;事實上，今年來不少建商藉助新政利好，促銷力度也是真金白銀的讓利。抽獎送豪車、一口價、打八折、送幾十萬裝修等促銷手法層出不窮，像是在黃金周推出的廣州新建案「新世界 &middot; 天馥」76 到 139 平方公尺江景三四房新品，開賣價最高可享 83 折，且每套房附贈 40 到 70 萬人民幣的豪華裝潢。&lt;/p&gt;

&lt;p&gt;此外，廣東保利旗下的保利燕語堂悅、保利招商華發中央公館推出買房送蔚來汽車活動，而萬科瑧樾府成交則送價值 46.98 萬元問界 M9 增程 Max 六座版。&lt;/p&gt;

&lt;p&gt;克而瑞廣佛首席市場分析師肖文曉則預期，本次取消限購，市場可實現平穩過渡，有助於實現促進廣州房地產市場止跌回穩的目標。中原地產項目總經理黃韜表示，從一線市場反應來看，新政推出後的這幾天看房熱情非常高漲，在不限購、利率、首付等系列利好政策的疊加下，今年廣州「銀十」以及第四季房市成交量一定有一個較為明顯的反彈。&lt;/p&gt;

&lt;p&gt;另外，還有建商為促進成交，甚至幫客戶賣中古屋，像是廣東保利旗下 12 個建案就有專人免費為客戶提供舊房幫賣服務，包括舊屋美化建議、房屋價值梳理、3 公里範圍網格化推廣、全城經紀人攪動、成交過戶指導等優質服務，更會補貼高額二手傭金，傭金補貼最高可達 7 萬元。&lt;/p&gt;

&lt;p&gt;廣東省城鄉規劃院住房政策研究中心首席研究員李宇嘉表示，龍頭企業如果帶頭保價，無理由退房，有利於帶動供給端價格穩定，並能打消購屋者對房價下降的顧慮。&lt;/p&gt;
",None,"[""樓市"", ""看房"", ""中國房市"", ""十一黃金周"", ""國慶連假""]",2024-10-03 10:31:28,大陸房市,848
5730434,https://news.cnyes.com/news/id/5730434,颱風假南北商場營業時間大不同 新光三越周慶如期開跑,"&lt;p&gt;山陀兒颱風來襲造成全台續放颱風假，不過，南北百貨商場營業時間大不同，今 (3) 日北部包括台北 101、新光三越、遠東 SOGO、微風和環球購物中心等大型商場均正常營業，新光三越嘉義以北的店點首波周年慶也如期開跑；而位於高雄的百貨商場今日多暫停營業。&lt;/p&gt;

&lt;p&gt;台北 101 表示，購物中心和大樓餐廳、觀景台上午 11 點開始正常營運，部分品牌可能會自主決定暫停營業，詳情請洽詢各品牌；而營業狀況如有任何變更，將另行於官網和社群媒體公告。&lt;/p&gt;

&lt;p&gt;新光三越說明，受颱風影響，台南以南 4 店點包括台南中山店、台南新天地、高雄左營店和高雄三多店，以及 SKM Park Outlets 高雄草衙，今日均暫停營業一天，其餘全台各分店正常營業。&lt;/p&gt;

&lt;p&gt;而新光三越周年慶首波活動 (台北南西店、桃園站前店、台中中港店、嘉義垂楊店）今日也如期開跑；至於台南中山店、高雄三多店周慶活動將延後一日，於明日開始。&lt;/p&gt;

&lt;p&gt;環球購物中心說明，北部六店包括新北中和、板橋車站、南港車站、桃園 A8、林口 A9、桃園 A19 今日正常營業，而南部兩店營業時間也不同，新左營車站暫停營業，屏東市延至中午 12 點營業。&lt;/p&gt;

&lt;p&gt;京站時尚廣場 (含轉運站商場、心中山爵士廣場、小碧潭店) 說明，未受颱風影響，正常營業，將視風雨大小進行滾動式調整。&lt;/p&gt;

&lt;p&gt;而微風旗下位於台北和基隆的店點今日皆正常營業，微風台大醫院配合院方規範。&lt;/p&gt;
",南北商場營業時間大不同 新光三越周慶如期開跑,"[""新光三越"", ""SOGO"", ""微風"", ""京站"", ""颱風""]",2024-10-03 10:24:02,台股新聞,827
5730321,https://news.cnyes.com/news/id/5730321,微軟將投資48億美元 在義大利興建AI與雲端基礎設施,"&lt;p&gt;微軟週三 (2 日) 發布聲明稱，公司計劃在未來兩年內投資 43 億歐元 (48 億美元)，以加強其在義大利北部的人工智慧 (AI) 和雲端基礎設施。&lt;/p&gt;

&lt;p&gt;微軟主席 Brad Smith 在義大利首都羅馬，與總理梅洛尼 (Giorgia Meloni) 會面時宣布上述消息，表示有關項目將是美國企業目前為止在該國最大的投資，將會成為微軟歐洲最大資料中心之一，同時也是地中海和北非的資料中心。&lt;/p&gt;

&lt;p&gt;貝萊德和微軟上月宣布設立一檔價值超過 300 億美元的基金，用於投資以人工智慧為重點的資料中心、人工智慧供應鏈和能源採購，並表示該投資工具將首先關注美國市場，然後再關注美國合作夥伴國家。&lt;/p&gt;

&lt;p&gt;義大利總理辦公室表示，歡迎微軟作出上述投資。&lt;/p&gt;

&lt;p&gt;微軟相當看好 AI 未來前景，OpenAI 週三聲明表示已完成最新一輪融資，募得 66 億美元資金，公司估值達 1,570 億美元，微軟 (MSFT-US) 是參與者之一。&lt;/p&gt;

&lt;p&gt;先前微軟未來三年將在墨西哥加碼投資折合新台幣 416 億元，加強當地 AI 基礎建設，這次微軟大手筆的投資分成三年來看，每年約將新增近 140 億元訂單。&lt;/p&gt;
",微軟週三 (2 日) 發布聲明稱，公司計劃在未來兩年內投資 43 億歐元 (48 億美元)，以加強其在義大利北部的人工智慧 (AI) 和雲端基礎設施。,"[""微軟"", ""AI"", ""義大利""]",2024-10-03 10:00:07,美股雷達,831
5730185,https://news.cnyes.com/news/id/5730185,伊朗動手了 狂射飛彈轟以色列 這對國際油價意味著什麼？,"&lt;p&gt;伊朗周二（1 日）動手了，狂射飛彈轟以色列，分析師認為，此次以伊衝突對國際油市的影響可能比較接近今年 4 月的情況，短期內油價走勢可能出現衝高回落態勢，重點要關注以色列後續回應。&lt;/p&gt;

&lt;p&gt;伊朗周二對以色列發動飛彈襲擊，據《伊通社》周三報導，伊朗伊斯蘭革命衛隊稱，「儘管相關地區受到最先進、最大規模防空系統的保護，但 90% 飛彈都成功擊中目標」。&lt;/p&gt;

&lt;p&gt;伊朗伊斯蘭革命衛隊表示，是在合法防禦權利框架內採取行動，並以國際法為基礎，「敵人的任何愚蠢行徑，都將以破壞性和令人遺憾的方式得到回應」。&lt;/p&gt;

&lt;p&gt;伊朗是世界十大石油生產國之一，石油輸出國組織（OPEC）月度報告顯示，伊朗 8 月石油產量約 328 萬桶 / 日。&lt;/p&gt;

&lt;p&gt;伊朗此次出手，加劇了市場對石油供應的擔憂，有投資人擔心，不斷升級的地緣近圖，可能會限制伊朗原油出口，從而推高國際油價。&lt;/p&gt;

&lt;p&gt;據《第一財經》報導，多名業界人士認為，以色列後續回應是關鍵，重點要關注地緣衝突是否會發展成更廣泛戰爭，從而限制石油供應或拉高運輸成本。&lt;/p&gt;

&lt;p&gt;據美國《Axios》周三報導，以色列官員透露，計劃在未來幾天內對伊朗發動重大報復，襲擊目標可能是伊朗境內石油生產設施和其他戰略地點。&lt;/p&gt;

&lt;p&gt;以色列官員表示，採取針對性暗殺或摧毀伊朗防空系統，也是潛在報復選項。&lt;/p&gt;

&lt;p&gt;「事實上，伊朗此次行動整體在預料之中，且伊方針對此次襲擊已提前通知。」一名能源公司原油分析師說，伊朗和以色列此次衝突可參照今年 4 月的情況，彼時雙方行動都比較克制，不希望擴大衝突，「當時油價走勢是衝高回落，此番或較為相似」。&lt;/p&gt;

&lt;p&gt;據《MarketWatch》報導，Ballinger Group 外匯市場分析師 Kyle Chapman 也表示，雙方都沒有強烈動機發動「可能引發崩潰的地區戰爭」。&lt;/p&gt;
",伊朗周二（1 日）動手了，狂射飛彈轟以色列，分析師認為，此次以伊衝突對國際油市的影響可能比較接近今年 4 月的情況，短期內油價走勢可能出現衝高回落態勢，重點要關注以色列後續回應。,"[""以色列"", ""伊朗"", ""國際油價"", ""中東""]",2024-10-03 10:00:04,國際政經,833
5730338,https://news.cnyes.com/news/id/5730338,以伊衝突加劇！比特幣再遇賣壓力守6萬大關 專家：若以色列回擊 恐跌至5.7萬美元,"&lt;p&gt;由於以色列與伊朗衝突加劇，加密貨幣遭遇一波拋售潮，比特幣 (&lt;a data-symbol-template=&quot;CC:BTC:FOREX:COMMON&quot; href=&quot;#&quot;&gt;BTC&lt;/a&gt;) 在今 (3) 日亞洲早盤交易時段續跌，一度跌破 6 萬美元大關，之後縮小跌幅力守於 6.05 萬美附近，以太幣(&lt;a data-symbol-template=&quot;CC:ETH:FOREX:COMMON&quot; href=&quot;#&quot;&gt;ETH&lt;/a&gt;) 也跌破 2400 美元大關，幣安幣 (&lt;a data-symbol-template=&quot;CC:BNB:FOREX:COMMON&quot; href=&quot;#&quot;&gt;BNB&lt;/a&gt;) 昨日更出現近 8% 跌勢，Solana 跌超 6%，狗狗幣跌超 10%，艾達幣跌 8.68%。&lt;/p&gt;

&lt;p&gt;加密貨幣急速下挫，更讓不少人爆倉。根據 coinglass 數據，截至今日早上 8 時 30 分，過去共有 8 萬 6686 人被爆倉，此前爆倉人數更一度達到 16.55 萬人，爆倉總金額高達 5.55 億美元。&lt;/p&gt;

&lt;p&gt;在中東緊張局勢升級的情況下，美國的比特幣 ETF 週二 (1 日) 流出 2.426 億美元資金，創 9 月 3 日以來最大流出規模糟糕的一天，以太幣 ETF 也遭受重創，流出 4850 萬美元，這是自 9 月 23 日以來最糟糕的一天。&lt;/p&gt;

&lt;p&gt;與加密貨幣相關的股票 Bitdeer(&lt;a data-symbol-template=&quot;USS:BSGA:STOCK:COMMON&quot; href=&quot;#&quot;&gt;BSGA-US&lt;/a&gt;) 、Cleanspark(&lt;a data-symbol-template=&quot;USS:CLSK:STOCK:COMMON&quot; href=&quot;#&quot;&gt;CLSK-US&lt;/a&gt;) ，Coinbase(&lt;a data-symbol-template=&quot;USS:COIN:STOCK:COMMON&quot; href=&quot;#&quot;&gt;COIN-US&lt;/a&gt;) 、Marathon Digital(&lt;a data-symbol-template=&quot;USS:MARA:STOCK:COMMON&quot; href=&quot;#&quot;&gt;MARA-US&lt;/a&gt;) 也在週三 (2 日) 繼續下跌。&lt;/p&gt;

&lt;p&gt;分析師 Justin Bennett 最新預測，鑑於伊朗對以色列發動飛彈攻擊後比特幣價格跌至 6 萬美元附近，以色列即將對伊朗發動的報復攻擊恐致價格下跌至 5.7 萬美元，但比特幣的長期前景仍然看漲，因為第四季將出現一些有利因素。&lt;/p&gt;

&lt;p&gt;Bennett 認為，比特幣價格由跌轉漲的唯一方式是重返 6.2 萬美元，但在此之前空方將佔據市場主導地位，比特幣有可能跌破 6 萬美元。&lt;/p&gt;

&lt;p&gt;不過，考量到一些事件可能成為比特幣的推動力，比特幣長期前景仍然看漲，例如在宏觀經濟方面，聯準會 (Fed) 仍可能在年底前再降息 2 碼，且中國已對自身經濟注入流動性。由於美中兩國貨幣寬鬆政策，全球流動性激增，這對比特幣價格有利。&lt;/p&gt;

&lt;p&gt;此外，美國總統選舉的結果也對比特幣是利多，因其為市場提供了確定性。無論是川普還是賀錦麗獲勝，一旦選舉結束，比特幣都可能創下新高。&lt;/p&gt;
",None,"[""比特幣"", ""以伊衝突"", ""拋售"", ""美國大選""]",2024-10-03 09:10:08,國際政經,833
